{
  "schema": "model.v1",
  "id": "example.box",
  "type": "static",
  "units": "meter",
  "parts": [
    {
      "id": "box",
      "shape": "box",
      "size": [
        1,
        1,
        1
      ],
      "position": [
        0,
        0.5,
        0
      ],
      "material": "wood.warm"
    }
  ]
}
